{
  "$schema": "../../schemas/v1.7-cross-device-consistency.schema.json",
  "schemaVersion": 1,
  "contractId": "goreecloud.glaze-ui.v1.7.cross-device-consistency",
  "name": "Glaze UI V1.7 Cross-Device Consistency Without Uniformity Development Contract",
  "version": "1.7.0-dev.35",
  "lifecycle": "Development",
  "stableBaseline": "1.6.0",
  "consumerEligible": false,
  "planVersion": "v1.2",
  "v12SpecificationSections": [42],
  "sharedSemanticDimensions": [
    "semantic-vocabulary",
    "color-roles",
    "state-vocabulary",
    "motion-language",
    "material-hierarchy",
    "interaction-principles",
    "accessibility-expectations",
    "authority-boundaries"
  ],
  "supportedPlatforms": ["android-compose","apple-swiftui","web","linux-native"],
  "consistencyRequirements": {
    "semanticRoleConsistencyRequired": true,
    "semanticColorRoleConsistencyRequired": true,
    "semanticStateConsistencyRequired": true,
    "motionRelationshipConsistencyRequired": true,
    "materialHierarchyConsistencyRequired": true,
    "interactionPrincipleConsistencyRequired": true,
    "accessibilityExpectationConsistencyRequired": true,
    "authorityBoundaryConsistencyRequired": true
  },
  "uniformityNotRequired": {
    "pixelIdenticalPresentation": true,
    "identicalNativeControls": true,
    "identicalLayoutComposition": true,
    "identicalAnimationTiming": true,
    "identicalAnimationCurves": true,
    "identicalAnimationPaths": true,
    "identicalRenderingPrimitives": true,
    "identicalInputBindings": true,
    "identicalWindowingMechanics": true
  },
  "authority": {
    "presentationOnly": true,
    "semanticTruthOwnedByCallerOrProvider": true,
    "platformCapabilityOwnedByCallerOrPlatform": true,
    "nativeImplementationOwnedByPlatformOrApplication": true,
    "accessibilityStateOwnedByCallerOrPlatform": true,
    "providerTruthCreatedByGlaze": false,
    "platformCapabilityCreatedByGlaze": false,
    "nativeImplementationCreatedByGlaze": false,
    "accessibilityStateCreatedByGlaze": false,
    "applicationStateChangedByGlaze": false,
    "navigationExecutedByGlaze": false,
    "permissionGrantedByGlaze": false,
    "authorizationGrantedByGlaze": false,
    "acceptanceGrantedByGlaze": false,
    "lifecyclePromotionAutomatic": false
  },
  "dependencies": {
    "nativeGlazeKits": "1.7.0-dev.29",
    "expandedComponentSystem": "1.7.0-dev.30",
    "advancedThemeSystem": "1.7.0-dev.31",
    "glazeInspector": "1.7.0-dev.32",
    "glazeStudio": "1.7.0-dev.33",
    "accessibilityContinuity": "1.7.0-dev.34"
  },
  "acceptanceBoundary": {
    "sourceFoundationOnly": true,
    "section42Complete": false,
    "crossPlatformRenderedAcceptanceEstablished": false,
    "nativePlatformAcceptanceEstablished": false,
    "assistiveTechnologyAcceptanceEstablished": false,
    "representativeDeviceAcceptanceEstablished": false,
    "measuredPerformanceAcceptanceEstablished": false,
    "energyAcceptanceEstablished": false,
    "humanCrossDeviceReviewEstablished": false,
    "downstreamConsumerAcceptanceAutomatic": false,
    "releasePromotionAutomatic": false,
    "deploymentAcceptanceAutomatic": false,
    "productionAcceptanceAutomatic": false
  },
  "runtimeEntrypoint": "js/glaze-v1.7-cross-device-consistency.dev.mjs",
  "developmentAggregateEntrypoint": "js/glaze-v1.7-development.mjs",
  "tokenMap": "tokens/glaze-v1.7-cross-device-consistency.dev.json",
  "researchRecord": "research/v1.7-cross-device-consistency.md"
}
